9783401712789,"Dahle, Stefanie",2019,Rosa Rosenherz - ein Regenbogenpony für die Prinzessin,Rosa Rosenherz - ein Regenbogenpony für die Prinzessin,Arena,K Kinder- und Jugendliteratur,EUR 14.00 (DE),https://d-nb.info/1169502946,Bilderbuch,Rosa Rosenherz - ein Regenbogenpony für die Prinzessin / Stefanie Dahle,"Dahle, Stefanie (Verfasser, Künstler)",Arena-Verlag (Verlag),1. Auflage,Würzburg : Arena,Erscheinungsdatum: 2019,"24 ungezählte Seiten : Illustrationen ; 29 cm, 400 g",Keine weiteren Ausgaben gefunden,"978-3-401-71278-9 Festeinband : EUR 14.00 (DE), EUR 14.40 (AT), CHF 19.50 (freier Preis)3-401-71278-0",9783401712789,Deutsch (ger),In Beziehung stehende Ressource: ISBN: 9783401706290,Vorschulkind, Keine Schlagwörter gefunden,K Kinder- und Jugendliteratur,Erzählerische Bilderbücher,https://d-nb.info/1169502946/about/marcxml,https://d-nb.info/1169502946/about/bibframe,http://www.buchhandel.de/buch/9783401712789?MVB-Kennnummer=83426,Inhaltstext,,,,Bestellnummer: 71278,,,,
9783411093113,"Delafosse, Claude",1999,Am Himmel und im Weltall,Am Himmel und im Weltall,Meyers Lexikonverl.,07 Kinder- und Jugendliteratur,EUR 8.95 (DE),https://d-nb.info/956282628,Sachbilderbuch,Am Himmel und im Weltall / ausgedacht von Claude Delafosse. Ill. von Donald Grant. Übers. von Salah Naoura,"Delafosse, Claude (Mitwirkender)Grant, Donald (Mitwirkender)Naoura, Salah (Übersetzer)",Organisationen nicht gefunden,Ausgabe nicht gefunden,Mannheim ; Leipzig ; Wien ; Zürich : Meyers Lexikonverl.,Erscheinungsdatum: 1999,[38] S. : überw. Ill. ; 18 cm,Keine weiteren Ausgaben gefunden,"3-411-09311-0 Pp. : DM 9.90978-3-7373-7512-2 (Fischer Meyers) : EUR 8.95 (DE), EUR 9.20 (AT), sfr 13.50 (freier Pr.)",9783411093113,"Deutsch (ger), Originalsprache(n): Französisch (fre)",Meyers kleine Kinderbibliothek / Licht an ; 8,Vorschulkind,Weltall ; SachbilderbuchHimmel ; Sachbilderbuch,07 Kinder- und Jugendliteratur,Gattung nicht gefunden,https://d-nb.info/956282628/about/marcxml,https://d-nb.info/956282628/about/bibframe,http://www.buchhandel.de/buch/3411093110?MVB-Kennnummer=83426,,Le ciel et l'espace (dt.),,"Lizenz des Bibliogr. Inst. und F. A. Brockhaus, Mannheim",,,,,
9783411093717,"Delafosse, Claude",2002,Leben im Dschungel,Leben im Dschungel,Meyers Lexikonverl.,07 Kinder- und Jugendliteratur,EUR 7.90 (DE),https://d-nb.info/963846299,Sachbilderbuch,Leben im Dschungel / ausgedacht von Claude Delafosse. Ill. von Christian Broutin. Übers. von Eva-Maria Dreyer,"Delafosse, Claude (Mitwirkender)Broutin, Christian (Mitwirkender)Dreyer, Eva-Maria (Übersetzer)",Organisationen nicht gefunden,Ausgabe nicht gefunden,Mannheim ; Leipzig ; Wien ; Zürich : Meyers Lexikonverl.,Erscheinungsdatum: 2002,[28] S. : zahrl. Ill. ; 18 cm,Keine weiteren Ausgaben gefunden,"3-411-09371-4 Pp. spiralgeh. : EUR 7.90 (DE), EUR 8.20 (AT), sfr 14.60978-3-7373-7516-0 (Fischer Meyers) : EUR 8.95 (DE), EUR 9.20 (AT), sfr 13.50 (freier Pr.)",9783411093717,"Deutsch (ger), Originalsprache(n): Französisch (fre)",Die kleine Kinderbibliothek / Licht an ; 14,Vorschulkind,Dschungel ; Tiere ; Sachbilderbuch,07 Kinder- und Jugendliteratur,Gattung nicht gefunden,https://d-nb.info/963846299/about/marcxml,https://d-nb.info/963846299/about/bibframe,http://www.buchhandel.de/buch/3411093714?MVB-Kennnummer=83426,,La jungle (dt.),,,,,,,
9783888974489,"Hacke, Axel",2006,Der kleine Erziehungsberater,Der kleine Erziehungsberater,Kunstmann,640 Hauswirtschaft und Familienleben,EUR 9.90 (DE),https://d-nb.info/979558859,Erlebnisbericht,Der kleine Erziehungsberater / Axel Hacke. Mit Bildern von Michael Sowa,"Hacke, Axel (Verfasser)",Organisationen nicht gefunden,Ausgabe nicht gefunden,München : Kunstmann,Erscheinungsdatum: 2006,90 S. : Ill. ; 18 cm,"Erscheint auch als Online-Ausgabe: Hacke, Axel: Der kleine Erziehungsberater","978-3-88897-448-9 Pp. : EUR 9.90 (DE), EUR 10.20 (AT), sfr 17.903-88897-448-8 Pp. : EUR 9.90 (DE), EUR 10.20 (AT), sfr 17.90",9783888974489,Sprache nicht gefunden,Keine Beziehungen gefunden,Keine Zielgruppe gefunden,Familienerziehung ; Erlebnisbericht,640 Hauswirtschaft und Familienleben,Gattung nicht gefunden,https://d-nb.info/979558859/about/marcxml,https://d-nb.info/979558859/about/bibframe,http://www.buchhandel.de/buch/9783888974489?MVB-Kennnummer=83426,Inhaltstext,,,,,,,,
9783462051391,"Schorlau, Wolfgang",2024,Black Forest : Denglers elfter Fall (Bd. 11),Black Forest,Kiepenheuer & Witsch,830 Deutsche Literatur ; B Belletristik,EUR 18.00 (DE),https://d-nb.info/132583811X,Fiktionale Darstellung,Black Forest : Denglers elfter Fall / Wolfgang Schorlau,"Schorlau, Wolfgang (Verfasser)",Verlag Kiepenheuer & Witsch (Verlag),1. Auflage,Köln : Kiepenheuer & Witsch,Erscheinungsdatum: 2024,442 Seiten ; 22 cm,"Erscheint auch als: ISBN: 9783839821473Erscheint auch als: ISBN: 9783732421473Erscheint auch als Online-Ausgabe: Schorlau, Wolfgang: Black Forest","978-3-462-05139-1 Broschur : EUR 18.00 (DE), EUR 18.50 (AT)3-462-05139-3",9783462051391,Deutsch (ger),In Beziehung stehende Ressource: ISBN: 9783462002751In Beziehung stehende Ressource: ISBN: 9783462053364In Beziehung stehende Ressource: ISBN: 9783462049312In Beziehung stehende Ressource: ISBN: 9783462045475In Beziehung stehende Ressource: ISBN: 9783462042795In Beziehung stehende Ressource: ISBN: 9783462041323In Beziehung stehende Ressource: ISBN: 9783462039825In Beziehung stehende Ressource: ISBN: 9783462037487In Beziehung stehende Ressource: ISBN: 9783462036145In Beziehung stehende Ressource: ISBN: 9783462034790,Keine Zielgruppe gefunden, Keine Schlagwörter gefunden,830 Deutsche Literatur ; B Belletristik,"Krimis, Thriller, Spionage",https://d-nb.info/132583811X/about/marcxml,https://d-nb.info/132583811X/about/bibframe,http://www.buchhandel.de/buch/9783462051391?MVB-Kennnummer=83426,Inhaltstext,,,,,,,,
9783898594608,"Kettl-Römer, Barbara",2017,Allgäu mit Kindern : die 300 schönsten Ausflüge und Erlebnisse für Freizeit und Ferien,Allgäu mit Kindern,pmv Peter Meyer Verlag,"914.3 Geografie, Reisen (Deutschland)",EUR 16.95 (DE),https://d-nb.info/1122037813,Führer,Allgäu mit Kindern : die 300 schönsten Ausflüge und Erlebnisse für Freizeit und Ferien / von Barbara Kettl-Römer,"Kettl-Römer, Barbara (Verfasser)",pmv Peter Meyer Verlag (Verlag),1. Auflage,Saulheim i. Rheinhessen : pmv Peter Meyer Verlag,Erscheinungsdatum: [2017],"242 Seiten : Illustrationen, Karten ; 18 cm, 284 g",Keine weiteren Ausgaben gefunden,"978-3-89859-460-8 Broschur : EUR 16.95 (DE), EUR 17.43 (AT)3-89859-460-2",9783898594608,Deutsch (ger),Freizeitführer ... mit KindernIn Beziehung stehende Ressource: ISBN: 9783898594615,Keine Zielgruppe gefunden,Allgäu,"914.3 Geografie, Reisen (Deutschland)",Gattung nicht gefunden,https://d-nb.info/1122037813/about/marcxml,https://d-nb.info/1122037813/about/bibframe,http://www.buchhandel.de/buch/9783898594608?MVB-Kennnummer=83426,Ausführliche BeschreibungInhaltsverzeichnis,,,,,914.337104 [DDC22ger],,,
9783401607047,"Wege, Bianca",2023,Today I'll talk to him (Bd. 1),Today I'll talk to him,Arena,K Kinder- und Jugendliteratur,EUR 18.00 (DE),https://d-nb.info/1283764687,Jugendbuch,Today I'll talk to him / Bianca Wege,"Wege, Bianca (Verfasser)",Arena-Verlag (Verlag),1. Auflage,Würzburg : Arena,Erscheinungsdatum: 2023,383 Seiten ; 21 cm,"Erscheint auch als Online-Ausgabe: Wege, Bianca: Today I'll Talk to Him","978-3-401-60704-7 Broschur : EUR 18.00 (DE), EUR 18.50 (AT), CHF 24.50 (freier Preis)3-401-60704-9",9783401607047,Deutsch (ger),Keine Beziehungen gefunden,Jugend,Weibliche Jugend* ; Männliche Jugend* ; Erste Liebe* (*maschinell ermittelt),K Kinder- und Jugendliteratur,Jugendbücher ab 12 Jahre,https://d-nb.info/1283764687/about/marcxml,https://d-nb.info/1283764687/about/bibframe,http://www.buchhandel.de/buch/9783401607047?MVB-Kennnummer=83426,Inhaltstext,,"Gefolgt von: Wege, Bianca: Today I'll steal his heart",,Bestellnummer: 60704,,Abweichender Titel: I'll talk to him,,
9783788620554,"Meyer, Till",2013,Wölfe : im Revier der grauen Jäger,Wölfe,Tessloff,K Kinder- und Jugendliteratur,EUR 9.95 (DE),https://d-nb.info/1034508164,Kindersachbuch,Wölfe : im Revier der grauen Jäger / Till Meyer,"Meyer, Till (Mitwirkender)",Organisationen nicht gefunden,Ausgabe nicht gefunden,Nürnberg : Tessloff,Erscheinungsdatum: 2013,"48 S. : überw. Ill., Kt. ; 28 cm",Keine weiteren Ausgaben gefunden,"978-3-7886-2055-4 Pp. : EUR 9.95 (DE), EUR 10.30 (AT)",9783788620554,Deutsch (ger),Was ist was ; Bd. 104,Kind,Wolf ; Kindersachbuch,K Kinder- und Jugendliteratur,Sachbücher und Sachbilderbücher für Kinder und Jugendliche,https://d-nb.info/1034508164/about/marcxml,https://d-nb.info/1034508164/about/bibframe,http://www.buchhandel.de/buch/9783788620554?MVB-Kennnummer=83426,Inhaltsverzeichnis,,,,,,,,
9783570178348,"Schröder, Patricia",2021,Sophie im Land der Zauberponys,Sophie im Land der Zauberponys,cbj,K Kinder- und Jugendliteratur,EUR 8.00 (DE),https://d-nb.info/1220718254,Kinderbuch,Sophie im Land der Zauberponys / Patricia Schröder ; mit Bildern von Silke Voigt,"Schröder, Patricia (Verfasser)Voigt, Silke (Illustrator)",cbj (Verlag),1. Auflage,München : cbj,Erscheinungsdatum: 2021,"79 Seiten : Illustrationen ; 22 cm, 359 g",Erscheint auch als Druck-Ausgabe: ISBN: 9783570139219Erscheint auch als Online-Ausgabe: ISBN: 9783641041878,"978-3-570-17834-8 Festeinband : circa EUR 8.00 (DE), circa EUR 8.30 (AT), circa CHF 11.61, circa CHF 11.90 (freier Preis)3-570-17834-X",9783570178348,Deutsch (ger),"Erst ich ein Stück, dann duIn Beziehung stehende Ressource: ISBN: 9783570178317In Beziehung stehende Ressource: ISBN: 9783570178324In Beziehung stehende Ressource: ISBN: 9783570178331In Beziehung stehende Ressource: ISBN: 9783570178799In Beziehung stehende Ressource: ISBN: 9783570178904",Leseanfänger,Schulanfänger* (*maschinell ermittelt),K Kinder- und Jugendliteratur,"Erstlesealter, Vorschulalter",https://d-nb.info/1220718254/about/marcxml,https://d-nb.info/1220718254/about/bibframe,http://www.buchhandel.de/buch/9783570178348?MVB-Kennnummer=83426,InhaltstextInhaltsverzeichnis,,Vorangegangen ist: ISBN: 9783570139219,,,,,,
9783743210455,"Scrivan, Maria",2022,Nicht genug (Bd. 1),Nicht genug,Loewe,K Kinder- und Jugendliteratur,EUR 15.00 (DE),https://d-nb.info/1246770105,ComicKinderbuch,Nicht genug / Maria Scrivan ; aus dem Amerikanischen übersetzt von Harriet Fricke,"Scrivan, Maria (Verfasser, Künstler)Fricke, Harriet (Übersetzer)",Loewe Verlag GmbH (Verlag)Loewe Graphix (Herausgebendes Organ),1. Auflage,Bindlach : Loewe,Erscheinungsdatum: 2022,"238 Seiten ; 22 cm, 682 g",Erscheint auch als Online-Ausgabe: nICHt genug (nICHt genug-Reihe - Band 1)Erscheint auch als Online-Ausgabe: ISBN: 9783732017676Erscheint auch als Online-Ausgabe: ISBN: 9783732017683Erscheint auch als Online-Ausgabe: ISBN: 9783732017690,"978-3-7432-1045-5 Festeinband : EUR 15.00 (DE), EUR 15.50 (AT)3-7432-1045-2",9783743210455,"Deutsch (ger), Originalsprache(n): Englisch (eng)",Loewe Graphix,Kind,Ausgrenzung* ; Freund* ; Mobbing* ; Selbstwertgefühl* ; Selbstbewusstsein* (*maschinell ermittelt),K Kinder- und Jugendliteratur,Kinderbücher bis 11 Jahre,https://d-nb.info/1246770105/about/marcxml,https://d-nb.info/1246770105/about/bibframe,http://www.buchhandel.de/buch/9783743210455?MVB-Kennnummer=83426,InhaltstextInhaltsverzeichnis,Nat enough,"Fortgesetzt durch Band 2: Scrivan, Maria: Vergiss mich nicht",,,,,,
9783423709132,"Brooks, Kevin",2005,Lucas,Lucas,Dt. Taschenbuch-Verl.,K Kinder- und Jugendliteratur,EUR 12.00 (DE),https://d-nb.info/971251096,Jugendbuch,Lucas : Roman / Kevin Brooks. Aus dem Engl. von Uwe-Michael Gutzschhahn,"Brooks, Kevin (Verfasser)",Organisationen nicht gefunden,Dt. Erstausg.,München : Dt. Taschenbuch-Verl.,Erscheinungsdatum: 2005,447 S. ; 20 cm,Keine weiteren Ausgaben gefunden,"978-3-423-70913-2 kart. : EUR 12.00, sfr 21.103-423-70913-8 kart. : EUR 12.00, sfr 21.10",9783423709132,"Deutsch (ger), Originalsprache(n): Englisch (eng)",dtv ; 70913 : Extra,Jugend,Insel ; Männliche Jugend ; Fremder ; Einheimischer ; Vorurteil ; Jugendbuch,K Kinder- und Jugendliteratur,Jugendbücher ab 12 Jahre,https://d-nb.info/971251096/about/marcxml,https://d-nb.info/971251096/about/bibframe,http://www.buchhandel.de/buch/9783423709132?MVB-Kennnummer=83426,,Lucas (dt.),,,,,,,
9783772475146,"Behnke, Benjamin",2014,Trick 17 : 365 geniale Alltagstipps,Trick 17,Frech,"640 Hauswirtschaft und Familienleben ; 740 Grafik, angewandte Kunst",EUR 17.00 (DE),https://d-nb.info/1050886372,Ratgeber,Trick 17 : 365 geniale Alltagstipps : Lifehacks für alle Lebenslagen / Benjamin Behnke und Kai Daniel Du. [Ill.: Rosenrot],"Behnke, Benjamin (Mitwirkender)Du, Kai Daniel (Mitwirkender)",Rosenrot (Berlin) (Herausgebendes Organ),1. Aufl.,Stuttgart : Frech,Erscheinungsdatum: 2014,400 S. : zahlr. Ill. ; 21 cm,"Erscheint auch als Online-Ausgabe: Behnke, Benjamin: Trick 17","978-3-7724-7514-6 kart. : EUR 17.00 (DE), EUR 17.50 (AT), sfr 24.50 (freier Pr.)",9783772475146,Deutsch (ger),Topp,Keine Zielgruppe gefunden, Keine Schlagwörter gefunden,"640 Hauswirtschaft und Familienleben ; 740 Grafik, angewandte Kunst",Gattung nicht gefunden,https://d-nb.info/1050886372/about/marcxml,https://d-nb.info/1050886372/about/bibframe,http://www.buchhandel.de/buch/9783772475146?MVB-Kennnummer=83426,Inhaltsverzeichnis,,,,7514,640.41 [DDC22ger],,,
9783809026846,"Edvardsson, Mattias",2019,Der unschuldige Mörder,Der unschuldige Mörder,Limes,839 Literatur in anderen germanischen Sprachen ; B Belletristik,EUR 15.00 (DE),https://d-nb.info/1187049174,Fiktionale Darstellung,Der unschuldige Mörder : Roman / Mattias Edvardsson ; Deutsch von Annika Krummacher,"Edvardsson, Mattias (Verfasser)Krummacher, Annika (Übersetzer)",Limes Verlag (Verlag),1. Auflage,München : Limes,Erscheinungsdatum: [2019],"458 Seiten ; 22 cm, 564 g","Erscheint auch als: ISBN: 9783837149227Erscheint auch als: ISBN: 9783837149241Erscheint auch als: ISBN: 9783837149234Erscheint auch als Online-Ausgabe: Edvardsson, Mattias: Der unschuldige Mörder","978-3-8090-2684-6 Broschur : circa EUR 15.00 (DE), circa EUR 15.50 (AT), circa CHF 21.90 (freier Preis)3-8090-2684-0",9783809026846,"Deutsch (ger), Originalsprache(n): Schwedisch (swe)",In Beziehung stehende Ressource: ISBN: 9783809027058,Keine Zielgruppe gefunden, Keine Schlagwörter gefunden,839 Literatur in anderen germanischen Sprachen ; B Belletristik,"Krimis, Thriller, Spionage",https://d-nb.info/1187049174/about/marcxml,https://d-nb.info/1187049174/about/bibframe,http://www.buchhandel.de/buch/9783809026846?MVB-Kennnummer=83426,Inhaltstext,En nästan sann historia,,,,,,,
9783328104063,"Nikolai, Maria",2019,Die Schokoladenvilla - goldene Jahre (Bd. 2),Die Schokoladenvilla - goldene Jahre,Penguin Verlag,830 Deutsche Literatur ; B Belletristik,EUR 10.00 (DE),https://d-nb.info/118123137X,Fiktionale Darstellung,Die Schokoladenvilla - goldene Jahre / Maria Nikolai,"Nikolai, Maria (Verfasser)",Organisationen nicht gefunden,1. Auflage,München : Penguin Verlag,Erscheinungsdatum: 2019,718 Seiten ; 19 cm,"Erscheint auch als: ISBN: 9783844535532Erscheint auch als: ISBN: 9783844535082Erscheint auch als: ISBN: 9783844535693Erscheint auch als Online-Ausgabe: Nikolai, Maria: Die Schokoladenvilla – Goldene Jahre","978-3-328-10406-3 Broschur : circa EUR 10.00 (DE), circa EUR 10.30 (AT), circa CHF 14.50 (freier Preis)3-328-10406-2",9783328104063,Deutsch (ger),In Beziehung stehende Ressource: ISBN: 9783328103226In Beziehung stehende Ressource: ISBN: 9783844535532,Keine Zielgruppe gefunden, Keine Schlagwörter gefunden,830 Deutsche Literatur ; B Belletristik,Erzählende Literatur,https://d-nb.info/118123137X/about/marcxml,https://d-nb.info/118123137X/about/bibframe,http://www.buchhandel.de/buch/9783328104063?MVB-Kennnummer=83426,Inhaltstext,,,,,,,,
9783462006278,"Schorlau, Wolfgang",2024,Falsche Freunde : Commissario Morello ermittelt in Venedig,Falsche Freunde,Kiepenheuer & Witsch,830 Deutsche Literatur ; B Belletristik,EUR 12.00 (DE),https://d-nb.info/1305821300,Fiktionale Darstellung,"Falsche Freunde : Commissario Morello ermittelt in Venedig / Wolfgang Schorlau, Claudio Caiolo","Schorlau, Wolfgang (Verfasser)Caiolo, Claudio (Verfasser)",Verlag Kiepenheuer & Witsch (Verlag),1. Auflage,Köln : Kiepenheuer & Witsch,Erscheinungsdatum: 2024,"340 Seiten ; 19 cm, 303 g",Erscheint auch als Druck-Ausgabe: ISBN: 9783462003031Erscheint auch als Online-Ausgabe: ISBN: 9783462304909,"978-3-462-00627-8 Broschur : EUR 12.00 (DE), EUR 12.40 (AT)3-462-00627-4",9783462006278,Deutsch (ger),KiWi ; 1938In Beziehung stehende Ressource: ISBN: 9783462001471In Beziehung stehende Ressource: ISBN: 9783462002768,Keine Zielgruppe gefunden, Keine Schlagwörter gefunden,830 Deutsche Literatur ; B Belletristik,"Krimis, Thriller, Spionage",https://d-nb.info/1305821300/about/marcxml,https://d-nb.info/1305821300/about/bibframe,http://www.buchhandel.de/buch/9783462006278?MVB-Kennnummer=83426,InhaltstextInhaltsverzeichnis,,,,,,,,
9783757102012,"Grolik, Markus",2025,"Fluffy und Robocat - Vorsicht, Kung-Fu-Küken! (Bd. 1)","Fluffy und Robocat - Vorsicht, Kung-Fu-Küken!",rotfuchs,K Kinder- und Jugendliteratur,EUR 12.90 (DE),https://d-nb.info/1345093039,KinderbuchComic,"Fluffy und Robocat - Vorsicht, Kung-Fu-Küken! / Markus Grolik","Grolik, Markus (Verfasser, Künstler)",Organisationen nicht gefunden,Ausgabe nicht gefunden,Frankfurt am Main : rotfuchs,Erscheinungsdatum: 2025,"156 Seiten ; 23 cm, 358 g",Erscheint auch als Online-Ausgabe: ISBN: 9783733608842,"978-3-7571-0201-2 Festeinband : EUR 12.90 (DE), EUR 13.30 (AT)3-7571-0201-0",9783757102012,Deutsch (ger),Keine Beziehungen gefunden,Kind,Junge* ; Superheld* (*maschinell ermittelt),K Kinder- und Jugendliteratur,Kinderbücher bis 11 Jahre,https://d-nb.info/1345093039/about/marcxml,https://d-nb.info/1345093039/about/bibframe,http://www.buchhandel.de/buch/9783757102012?MVB-Kennnummer=83426,Inhaltstext,,,,,,,,
9783426791585,"Uhlig, Elena",2025,50 ist kein Tempolimit,50 ist kein Tempolimit,Knaur,150 Psychologie,EUR 18.00 (DE),https://d-nb.info/1362780782,Inhalt nicht gefunden,50 ist kein Tempolimit / Elena Uhlig mit Nicolle Hofman,"Uhlig, Elena (Verfasser)Hofman, Nicolle (Verfasser)",Knaur Taschenbuch (Verlag),Originalausgabe,München : Knaur,Erscheinungsdatum: Juli 2025,"217 Seiten ; 21 cm, 272 g","Erscheint auch als Online-Ausgabe: Uhlig, Elena: 50 ist kein TempolimitErscheint auch als: ISBN: 9783732484287","978-3-426-79158-5 Broschur : EUR 18.00 (DE), EUR 18.50 (AT)3-426-79158-7",9783426791585,Deutsch (ger),Keine Beziehungen gefunden,Keine Zielgruppe gefunden, Keine Schlagwörter gefunden,150 Psychologie,Gattung nicht gefunden,https://d-nb.info/1362780782/about/marcxml,https://d-nb.info/1362780782/about/bibframe,http://www.buchhandel.de/buch/9783426791585?MVB-Kennnummer=83426,InhaltstextInhaltstext,,,,,,,,
9783442483341,"Sund, Erik",2020,Puppentod (Bd. 2),Puppentod,Goldmann,839 Literatur in anderen germanischen Sprachen ; B Belletristik,EUR 12.99 (DE),https://d-nb.info/1181230829,Fiktionale Darstellung,Puppentod : Psychothriller / Erik Axl Sund ; aus dem Schwedischen von Nike Karen Müller,"Sund, Erik Axl (Verfasser)Müller, Nike Karen (Übersetzer)",Organisationen nicht gefunden,"1. Auflage, Deutsche Erstausgabe",München : Goldmann,Erscheinungsdatum: April 2020,"476 Seiten ; 21 cm, 544 g","Erscheint auch als: ISBN: 9783844535747Erscheint auch als: ISBN: 9783844535860Erscheint auch als: ISBN: 9783844535853Erscheint auch als Online-Ausgabe: Sund, Erik Axl: Puppentod","978-3-442-48334-1 Broschur : circa EUR 12.99 (DE), circa EUR 13.40 (AT), circa CHF 18.90 (freier Preis)3-442-48334-4",9783442483341,"Deutsch (ger), Originalsprache(n): Schwedisch (swe)","Sund, Erik Axl: Band ... der Kronoberg-Reihe ; Band 2In Beziehung stehende Ressource: ISBN: 9783442483334",Keine Zielgruppe gefunden, Keine Schlagwörter gefunden,839 Literatur in anderen germanischen Sprachen ; B Belletristik,"Krimis, Thriller, Spionage",https://d-nb.info/1181230829/about/marcxml,https://d-nb.info/1181230829/about/bibframe,http://www.buchhandel.de/buch/9783442483341?MVB-Kennnummer=83426,Inhaltstext,Grå melankoli,,,,,,,
9783442483358,"Sund, Erik",2023,Waldgrab (Bd. 3),Waldgrab,Goldmann,839 Literatur in anderen germanischen Sprachen ; B Belletristik,EUR 15.00 (DE),https://d-nb.info/125468638X,Fiktionale Darstellung,Waldgrab : Psychothriller / Erik Axl Sund ; aus dem Schwedischen von Nike Karen Müller,"Sund, Erik Axl (Verfasser)Müller, Nike Karen (Übersetzer)",Organisationen nicht gefunden,"1. Auflage, deutsche Erstveröffentlichung",München : Goldmann,Erscheinungsdatum: Januar 2023,"492 Seiten ; 21 cm, 562 g","Erscheint auch als Online-Ausgabe: Sund, Erik Axl: WaldgrabErscheint auch als: ISBN: 9783844546736","978-3-442-48335-8 Broschur : EUR 15.00 (DE), EUR 15.50 (AT), circa CHF 21.90 (freier Preis)3-442-48335-2",9783442483358,"Deutsch (ger), Originalsprache(n): Schwedisch (swe)","Sund, Erik Axl: Band ... der Kronoberg-Reihe ; Band 3In Beziehung stehende Ressource: ISBN: 9783442483334In Beziehung stehende Ressource: ISBN: 9783442483341",Keine Zielgruppe gefunden, Keine Schlagwörter gefunden,839 Literatur in anderen germanischen Sprachen ; B Belletristik,"Krimis, Thriller, Spionage",https://d-nb.info/125468638X/about/marcxml,https://d-nb.info/125468638X/about/bibframe,http://www.buchhandel.de/buch/9783442483358?MVB-Kennnummer=83426,Inhaltstext,Otid,,,,,,,
9783328111245,"Harari, Yuval",2024,Sapiens : eine kurze Geschichte der Menschheit,Sapiens,Penguin Verlag,"300 Sozialwissenschaften, Soziologie, Anthropologie ; 900 Geschichte",EUR 13.00 (DE),https://d-nb.info/1297753658,Inhalt nicht gefunden,Sapiens : eine kurze Geschichte der Menschheit / Yuval Noah Harari ; aus dem Englischen von Jürgen Neubauer,"Harari, Yuval Noaḥ (Verfasser)Neubauer, Jürgen (Übersetzer)",Organisationen nicht gefunden,1. Auflage,München : Penguin Verlag,Erscheinungsdatum: [2024],"526 Seiten : Illustrationen ; 19 cm, 363 g",Erscheint auch als Online-Ausgabe: ISBN: 9783641104986Erscheint auch als Druck-Ausgabe: ISBN: 9783421048554Erscheint auch als Druck-Ausgabe: ISBN: 9783570552698Erscheint auch als: ISBN: 9783844512441Erscheint auch als: ISBN: 9783844513127Erscheint auch als Online-Ausgabe: ISBN: 9783641319236,"978-3-328-11124-5 Broschur : circa EUR 13.00 (DE), circa EUR 13.40 (AT), circa CHF 18.05, circa CHF 18.50 (freier Preis)3-328-11124-7",9783328111245,"Deutsch (ger), Originalsprache(n): Hebräisch (heb)",In Beziehung stehende Ressource: ISBN: 9783328102878In Beziehung stehende Ressource: ISBN: 9783421048554In Beziehung stehende Ressource: ISBN: 9783570552698,Keine Zielgruppe gefunden,Menschheit ; Kulturelle Evolution ; Kognitive Entwicklung ; Geschichte,"300 Sozialwissenschaften, Soziologie, Anthropologie ; 900 Geschichte",Gattung nicht gefunden,https://d-nb.info/1297753658/about/marcxml,https://d-nb.info/1297753658/about/bibframe,http://www.buchhandel.de/buch/9783328111245?MVB-Kennnummer=83426,InhaltstextInhaltsverzeichnis,"Harari, Yuval Noaḥ: Ḳitsur toldot ha-enoshut",Vorangegangen ist: ISBN: 9783328102878,,,306.09 [DDC22ger],,,
9783423284783,"Behm, Martina",2025,Hier draußen,Hier draußen,dtv,830 Deutsche Literatur ; B Belletristik,EUR 24.00 (DE),https://d-nb.info/1345843925,Fiktionale Darstellung,Hier draußen : Roman / Martina Behm,"Behm, Martina (Verfasser)",Deutscher Taschenbuch-Verlag (München) (Verlag),Ausgabe nicht gefunden,München : dtv,Erscheinungsdatum: [2025],"490 Seiten ; 21 cm, 594 g","Erscheint auch als Druck-Ausgabe: ISBN: 9783423284714Erscheint auch als Online-Ausgabe: ISBN: 9783423492683Erscheint auch als Online-Ausgabe: Behm, Martina: Hier draußen","978-3-423-28478-3 Festeinband : circa EUR 24.00 (DE), circa EUR 24.70 (AT), circa CHF 32.50 (freier Preis)3-423-28478-1",9783423284783,Deutsch (ger),Keine Beziehungen gefunden,Keine Zielgruppe gefunden, Keine Schlagwörter gefunden,830 Deutsche Literatur ; B Belletristik,Erzählende Literatur,https://d-nb.info/1345843925/about/marcxml,https://d-nb.info/1345843925/about/bibframe,http://www.buchhandel.de/buch/9783423284783?MVB-Kennnummer=83426,InhaltstextInhaltsverzeichnis,,,,,,,,
9783328104070,"Nikolai, Maria",2020,Die Schokoladenvilla - Zeit des Schicksals (Bd. 3),Die Schokoladenvilla - Zeit des Schicksals,Penguin Verlag,830 Deutsche Literatur ; B Belletristik,EUR 11.00 (DE),https://d-nb.info/1207859702,Fiktionale Darstellung,Die Schokoladenvilla - Zeit des Schicksals / Maria Nikolai,"Nikolai, Maria (Verfasser)",Organisationen nicht gefunden,1. Auflage,München : Penguin Verlag,Erscheinungsdatum: 2020,"638 Seiten ; 19 cm, 536 g","Erscheint auch als Online-Ausgabe: Nikolai, Maria: Die Schokoladenvilla - Zeit des Schicksals. Die Vorgeschichte zu Band 3Erscheint auch als Online-Ausgabe: ISBN: 9783641237295Erscheint auch als: ISBN: 9783844539813","978-3-328-10407-0 Broschur : circa EUR 11.00 (DE), circa EUR 11.40 (AT), circa CHF 16.90 (freier Preis)3-328-10407-0",9783328104070,Deutsch (ger),In Beziehung stehende Ressource: ISBN: 9783328103226In Beziehung stehende Ressource: ISBN: 9783328104063,Keine Zielgruppe gefunden, Keine Schlagwörter gefunden,830 Deutsche Literatur ; B Belletristik,Erzählende Literatur,https://d-nb.info/1207859702/about/marcxml,https://d-nb.info/1207859702/about/bibframe,http://www.buchhandel.de/buch/9783328104070?MVB-Kennnummer=83426,Inhaltstext,,,,,,,,
